{
  "description": "Non-AI student starter with social media, evening streaming, one Zoom class, and one hour of fixed-reference Xbox Series X gaming.",
  "deviceSelections": {
    "gaming-console-xbox-series-x": "xbox-series-x-reference",
    "instagram": "phone",
    "netflix": "laptop",
    "snapchat": "phone",
    "tiktok": "phone",
    "youtube": "phone",
    "zoom-participant": "laptop"
  },
  "id": "gen-z-no-ai",
  "label": "Gen Z (no AI use)",
  "order": 2,
  "values": {
    "gaming-console-xbox-series-x": 1,
    "instagram": 0.75,
    "netflix": 1.5,
    "snapchat": 0.5,
    "tiktok": 1.5,
    "youtube": 1.25,
    "zoom-participant": 1
  }
}
