{
  "description": "Section 3 scenario with 15 illustrative agentic tasks, counted as 15 human coding-agent requests, plus separate reasoning and text requests and reduced media time.",
  "deviceSelections": {
    "cloud-docs-browsing": "laptop",
    "netflix": "laptop",
    "tiktok": "phone",
    "youtube": "phone",
    "zoom-participant": "laptop"
  },
  "id": "gen-z-vibe-coder",
  "label": "Gen Z (vibe coder)",
  "order": 4,
  "values": {
    "cloud-docs-browsing": 1,
    "coding-agent-requests-intensive": 15,
    "image-generation": 2,
    "netflix": 0.75,
    "reasoning-prompts": 8,
    "text-prompts": 15,
    "tiktok": 0.25,
    "youtube": 1,
    "zoom-participant": 1
  }
}
